user_reviews,user_rating,review_text,days_since_review,popular,rating_diff,quote,review_length,sentiment_probabilities,lemmatized_text,countvectorized_data
218,5,"I think this is a must read for any leader in a modern business. Google has done a lot of things right both in their products and also in how they run their company and build their culture, and this is a fairly detailed account of how they've built an impressive culture, and is written by someone who knows - their head of HR. I'm a little surprised he told as much as he did - but I suppose it will only help for recruiting. 
 Goodreads is now a subsidiary of Amazon, and I have spent significant time learning to integrate the best of Amazons culture with ours. And I'm happy to say that many - perhaps most - of the best practices listed in the book are also used by Amazon. Things like hiring people smarter than you, hiring committees and having objective people on them, committees to approve promotions, focusing on the two tails, and more. These don't seem to be things all companies do yet - but should. 
 So while much of the practices were things I'm already doing or aware of - there was a lot I learned from the book too. Here are some of the bigger takeaways I had. 
 One of the more interesting ones was the notion to separate performance reviews from compensation discussions. This makes a lot of sense, is something we have already been making progress towards, and is something I'm going to think about more. 
 ""Traditional performance management systems make a big mistake. They combine two things that should be completely separate: performance evaluation and people development. Evaluation is necessary to distribute finite resources, like salary increases or bonus dollars. Development is just as necessary so people grow and improve."" If you want people to grow, don't have those two conversations at the same time. Make development a constant back-and-forth between you and your team members, rather than a year-end surprise."" 
 Another one was giving managers a bi-annual scorecards from their directs on how they did on ~10 dimensions that Google has determined are the determinants of a great manager. And no surprise (but very important to keep in mind), the book found that ""manager quality was the single best predictor of whether employees would stay or leave, supporting the adage that people don't quit companies, they quit bad managers."" While we do a lot of surveys, we haven't packaged up the managers feedback into a report like this, and I think that would be powerful. 
 Laszlo was impressive in citing lots of research to prove his points. It was one of my more favorite things about the book - he is clearly a student of human development. This led to lots of tidbits that apply pretty broadly, and which are great things to keep in mind when building a business. 
 The chapter on nudges was I think my favorite in the book. Pretty cool the depth to which they have taken these - reminds me a lot of the onboarding funnel analysis I've done for Goodreads - paying attention to where you can message timely, relevant, easily actionable messages that will result in people taking desired actions, and a/b testing the results. Pretty impressive they a/b test that kind of stuff at Google! Examples given were around lists on how to onboard someone as a manager, how to be onboarded as a newbie, how to get more people to save money earlier in life and enroll in the 401K program (his data here was impressive - on how people of the same income bracket vary widely on wealth accumulated in their lives based purely on how much they save when they are young), and how to get people to eat healthier by putting the healthier foods in the kitchens more prominently. 
 ""Nudges are an incredibly powerful mechanism for improving teams and organizations. They are also ideally suited to experimentation, so can be tested on smaller populations to fine-tune their results."" 
 Laszlo did a great job of explaining a lot of the psychology behind nudges too. My favorite was the research about checklists, and story about how the Airforce found that even the smartest, best trained pilots can make mistakes, but having checklists reduces their error rates significantly. 
 ""I realized that management too is phenomenally complex. It's a lot to ask of any leader to be a product visionary or a financial genius or a marketing wizard as well as an inspiring manager. But if we could reduce good management to a checklist, we wouldn't need to invest millions of dollars in training, or try to convince people why one style of leadership is better than another. We wouldn't have to change who they were. We could just change how they behave."" 
 ""It turns out checklists really do work, even when the list is almost patronizingly simple. We're human, and we sometimes forget the most basic things."" 
 Another thing I loved was the focus on identifying the people who are best at a specific skill, and designing a program for them to teach that skill to others. G2G (Googlers 2 Googlers). 
 ""Giving employees the opportunity to teach gives them purpose. Even if they don't find meaning in their regular jobs, passing on knowledge is both inspiring and inspirational."" 
 I liked his descriptions of deliberate learning. He gave examples of asking after every meeting ""what did we learn and how could we do better in the future"". And the story about Tiger hitting golf balls at 4am in the rain was pretty sweet. 
 ""Ericsson refers to this as deliberate practice: intentional repetitions of similar, small tasks with immediate feedback, correction, and experimentation."" 
 My favorite tidbit - which I know to be true but is something great to keep in mind - is how to motivate people: let them connect to the people their work is helping. 
 ""even a small connection to the people who benefit from your work not only improves productivity, it also makes people happier. And everyone wants their work to have purpose. 
 Bock, Laszlo (2015-04-07). Work Rules!: Insights from Inside Google That Will Transform How You Live and Lead (pp. 340-341). Grand Central Publishing. Kindle Edition.",763,1,0.8399999999999999,True,6004,0.4138847589492798,"I think this is a must read for any leader in a modern business . Google ha done a lot of thing right both in their product and also in how they run their company and build their culture , and this is a fairly detailed account of how they 've built an impressive culture , and is written by someone who know - their head of HR . I 'm a little surprised he told a much a he did - but I suppose it will only help for recruiting . Goodreads is now a subsidiary of Amazon , and I have spent significant time learning to integrate the best of Amazons culture with ours . And I 'm happy to say that many - perhaps most - of the best practice listed in the book are also used by Amazon . Things like hiring people smarter than you , hiring committee and having objective people on them , committee to approve promotion , focusing on the two tail , and more . These do n't seem to be thing all company do yet - but should . So while much of the practice were thing I 'm already doing or aware of - there wa a lot I learned from the book too . Here are some of the bigger takeaway I had . One of the more interesting one wa the notion to separate performance review from compensation discussion . This make a lot of sense , is something we have already been making progress towards , and is something I 'm going to think about more . `` Traditional performance management system make a big mistake . They combine two thing that should be completely separate : performance evaluation and people development . Evaluation is necessary to distribute finite resource , like salary increase or bonus dollar . Development is just a necessary so people grow and improve . '' If you want people to grow , do n't have those two conversation at the same time . Make development a constant back-and-forth between you and your team member , rather than a year-end surprise . '' Another one wa giving manager a bi-annual scorecard from their directs on how they did on ~10 dimension that Google ha determined are the determinant of a great manager . And no surprise ( but very important to keep in mind ) , the book found that `` manager quality wa the single best predictor of whether employee would stay or leave , supporting the adage that people do n't quit company , they quit bad manager . '' While we do a lot of survey , we have n't packaged up the manager feedback into a report like this , and I think that would be powerful . Laszlo wa impressive in citing lot of research to prove his point . It wa one of my more favorite thing about the book - he is clearly a student of human development . This led to lot of tidbit that apply pretty broadly , and which are great thing to keep in mind when building a business . The chapter on nudge wa I think my favorite in the book . Pretty cool the depth to which they have taken these - reminds me a lot of the onboarding funnel analysis I 've done for Goodreads - paying attention to where you can message timely , relevant , easily actionable message that will result in people taking desired action , and a/b testing the result . Pretty impressive they a/b test that kind of stuff at Google ! Examples given were around list on how to onboard someone a a manager , how to be onboarded a a newbie , how to get more people to save money earlier in life and enroll in the 401K program ( his data here wa impressive - on how people of the same income bracket vary widely on wealth accumulated in their life based purely on how much they save when they are young ) , and how to get people to eat healthier by putting the healthier food in the kitchen more prominently . `` Nudges are an incredibly powerful mechanism for improving team and organization . They are also ideally suited to experimentation , so can be tested on smaller population to fine-tune their result . '' Laszlo did a great job of explaining a lot of the psychology behind nudge too . My favorite wa the research about checklist , and story about how the Airforce found that even the smartest , best trained pilot can make mistake , but having checklist reduces their error rate significantly . `` I realized that management too is phenomenally complex . It 's a lot to ask of any leader to be a product visionary or a financial genius or a marketing wizard a well a an inspiring manager . But if we could reduce good management to a checklist , we would n't need to invest million of dollar in training , or try to convince people why one style of leadership is better than another . We would n't have to change who they were . We could just change how they behave . '' `` It turn out checklist really do work , even when the list is almost patronizingly simple . We 're human , and we sometimes forget the most basic thing . '' Another thing I loved wa the focus on identifying the people who are best at a specific skill , and designing a program for them to teach that skill to others . G2G ( Googlers 2 Googlers ) . `` Giving employee the opportunity to teach give them purpose . Even if they do n't find meaning in their regular job , passing on knowledge is both inspiring and inspirational . '' I liked his description of deliberate learning . He gave example of asking after every meeting `` what did we learn and how could we do better in the future '' . And the story about Tiger hitting golf ball at 4am in the rain wa pretty sweet . `` Ericsson refers to this a deliberate practice : intentional repetition of similar , small task with immediate feedback , correction , and experimentation . '' My favorite tidbit - which I know to be true but is something great to keep in mind - is how to motivate people : let them connect to the people their work is helping . `` even a small connection to the people who benefit from your work not only improves productivity , it also make people happier . And everyone want their work to have purpose . Bock , Laszlo ( 2015-04-07 ) . Work Rules ! : Insights from Inside Google That Will Transform How You Live and Lead ( pp . 340-341 ) . Grand Central Publishing . Kindle Edition .","{'000': 0, '04': 1, '07': 1, '09': 0, '10': 1, '100': 0, '11': 0, '1200': 0, '1500': 0, '17': 0, '1945': 0, '1970s': 0, '1985': 0, '20': 0, '200': 0, '2009': 0, '2015': 1, '2016': 0, '2017': 0, '20k': 0, '340': 1, '341': 1, '3d': 0, '3rd': 0, '40': 0, '400': 0, '401k': 1, '4am': 1, '4th': 0, '50': 0, '500': 0, '5013826': 0, '550': 0, '60': 0, '70': 0, '800': 0, '99': 0, 'a16z': 0, 'ability': 0, 'able': 0, 'about': 5, 'above': 0, 'absolutely': 0, 'absorbed': 0, 'accelerator': 0, 'accomplished': 0, 'according': 0, 'account': 1, 'accumulate': 0, 'accumulated': 1, 'accumulating': 0, 'accuracy': 0, 'accurate': 0, 'accusing': 0, 'achieved': 0, 'acquire': 0, 'acquired': 0, 'acquisition': 0, 'across': 0, 'action': 1, 'actionable': 1, 'activity': 0, 'actor': 0, 'actual': 0, 'actually': 0, 'ad': 0, 'adage': 1, 'add': 0, 'adding': 0, 'additional': 0, 'address': 0, 'adhere': 0, 'admired': 0, 'admit': 0, 'admittedly': 0, 'adopting': 0, 'adult': 0, 'advance': 0, 'advertised': 0, 'advice': 0, 'advisor': 0, 'affect': 0, 'afraid': 0, 'after': 1, 'afterwards': 0, 'again': 0, 'against': 0, 'age': 0, 'agents': 0, 'ago': 0, 'agree': 0, 'agricultural': 0, 'ai': 0, 'aim': 0, 'airforce': 1, 'airplane': 0, 'alfred': 0, 'algorithm': 0, 'alien': 0, 'alive': 0, 'all': 1, 'alliteration': 0, 'allocation': 0, 'allows': 0, 'alluded': 0, 'almost': 1, 'already': 2, 'also': 4, 'always': 0, 'am': 0, 'amanda': 0, 'amazing': 0, 'amazon': 2, 'amazons': 1, 'ambition': 0, 'america': 0, 'american': 0, 'americans': 0, 'amount': 0, 'an': 3, 'analog': 0, 'analogy': 0, 'analysis': 1, 'analyzes': 0, 'and': 29, 'andreeson': 0, 'animist': 0, 'anna': 0, 'announcement': 0, 'annual': 1, 'anonymity': 0, 'another': 3, 'answer': 0, 'answering': 0, 'antithesis': 0, 'any': 2, 'anymore': 0, 'anyone': 0, 'anything': 0, 'anyways': 0, 'anywhere': 0, 'apart': 0, 'apocalyptic': 0, 'appeal': 0, 'appealed': 0, 'applicable': 0, 'apply': 1, 'appreciation': 0, 'approve': 1, 'ar': 0, 'are': 8, 'area': 0, 'argues': 0, 'argument': 0, 'army': 0, 'around': 1, 'arrive': 0, 'art': 0, 'arthur': 0, 'artificial': 0, 'artist': 0, 'as': 0, 'ask': 1, 'asking': 1, 'aspire': 0, 'associated': 0, 'asteriod': 0, 'astounding': 0, 'astronaut': 0, 'astute': 0, 'at': 4, 'atmosphere': 0, 'attention': 1, 'attitude': 0, 'atwood': 0, 'audible': 0, 'audio': 0, 'aunt': 0, 'author': 0, 'authority': 0, 'automation': 0, 'autonomy': 0, 'avail': 0, 'average': 0, 'avoid': 0, 'aware': 1, 'away': 0, 'awesome': 0, 'back': 1, 'backbone': 0, 'backstory': 0, 'backward': 0, 'bad': 1, 'badass': 0, 'balance': 0, 'ball': 1, 'band': 0, 'based': 1, 'basic': 1, 'basically': 0, 'basing': 0, 'basis': 0, 'bathtub': 0, 'battery': 0, 'battle': 0, 'be': 7, 'bea': 0, 'bear': 0, 'beautiful': 0, 'became': 0, 'because': 0, 'become': 0, 'becomes': 0, 'becoming': 0, 'been': 1, 'beet': 0, 'befell': 0, 'before': 0, 'beginning': 0, 'behave': 1, 'behavior': 0, 'behind': 1, 'being': 0, 'belief': 0, 'believe': 0, 'believed': 0, 'belonging': 0, 'below': 0, 'ben': 0, 'benefit': 1, 'best': 5, 'better': 2, 'between': 1, 'bi': 1, 'biasing': 0, 'big': 1, 'bigger': 1, 'biggest': 0, 'billion': 0, 'binding': 0, 'bit': 0, 'black': 0, 'blame': 0, 'blew': 0, 'blind': 0, 'blitz': 0, 'blog': 0, 'blood': 0, 'blow': 0, 'blowingly': 0, 'blue': 0, 'board': 0, 'boat': 0, 'bock': 1, 'body': 0, 'boiled': 0, 'bond': 0, 'bonding': 0, 'bonus': 1, 'book': 5, 'born': 0, 'botanist': 0, 'botany': 0, 'both': 2, 'bots': 0, 'bracket': 1, 'brain': 0, 'branch': 0, 'bravest': 0, 'bread': 0, 'breath': 0, 'breed': 0, 'brilliant': 0, 'bring': 0, 'brings': 0, 'brink': 0, 'britain': 0, 'british': 0, 'broadly': 1, 'broken': 0, 'brought': 0, 'bucket': 0, 'buddhism': 0, 'buddhist': 0, 'buddy': 0, 'build': 1, 'building': 1, 'built': 1, 'bullet': 0, 'bunch': 0, 'burn': 0, 'business': 2, 'but': 6, 'buy': 0, 'by': 3, 'ca': 0, 'caa': 0, 'cable': 0, 'calculation': 0, 'call': 0, 'called': 0, 'calorie': 0, 'came': 0, 'can': 3, 'cancer': 0, 'candidate': 0, 'canvas': 0, 'capitalism': 0, 'caput': 0, 'car': 0, 'caravan': 0, 'carb': 0, 'care': 0, 'career': 0, 'carry': 0, 'case': 0, 'casualty': 0, 'catastrophe': 0, 'catch': 0, 'cause': 0, 'caused': 0, 'celebrity': 0, 'central': 1, 'century': 0, 'ceo': 0, 'ceos': 0, 'certain': 0, 'certainly': 0, 'ceti': 0, 'challenge': 0, 'change': 2, 'chaos': 0, 'chapter': 1, 'character': 0, 'chart': 0, 'chase': 0, 'chasing': 0, 'chatter': 0, 'cheap': 0, 'cheat': 0, 'check': 0, 'checklist': 4, 'chemistry': 0, 'chess': 0, 'child': 0, 'chilling': 0, 'chillingly': 0, 'china': 0, 'chinese': 0, 'choice': 0, 'christian': 0, 'chuang': 0, 'citing': 1, 'civilian': 0, 'civilization': 0, 'classic': 0, 'clean': 0, 'clear': 0, 'cleared': 0, 'clearly': 1, 'cleft': 0, 'climate': 0, 'close': 0, 'clothing': 0, 'cnn': 0, 'co': 0, 'cofounder': 0, 'cognition': 0, 'cold': 0, 'colin': 0, 'collapse': 0, 'collective': 0, 'college': 0, 'collision': 0, 'colonize': 0, 'color': 0, 'com': 0, 'combination': 0, 'combine': 1, 'combo': 0, 'combustion': 0, 'come': 0, 'coming': 0, 'commander': 0, 'committee': 2, 'commodity': 0, 'commonplace': 0, 'communal': 0, 'communication': 0, 'community': 0, 'companion': 0, 'company': 3, 'compared': 0, 'compelling': 0, 'compensation': 1, 'compete': 0, 'complaint': 0, 'complete': 0, 'completely': 1, 'complex': 1, 'comprehensive': 0, 'compromise': 0, 'computer': 0, 'concentrated': 0, 'concept': 0, 'concludes': 0, 'conclusion': 0, 'conclusive': 0, 'confidence': 0, 'congratulatory': 0, 'connect': 1, 'connected': 0, 'connection': 1, 'consciousness': 0, 'consider': 0, 'consistent': 0, 'constant': 1, 'consume': 0, 'consumed': 0, 'consumption': 0, 'contains': 0, 'content': 0, 'continent': 0, 'continue': 0, 'continuously': 0, 'contrary': 0, 'contrast': 0, 'control': 0, 'conventional': 0, 'conversation': 1, 'conversely': 0, 'convince': 1, 'cool': 1, 'cooperation': 0, 'core': 0, 'corn': 0, 'coronary': 0, 'correction': 1, 'correctly': 0, 'correlated': 0, 'cosmic': 0, 'cost': 0, 'could': 3, 'count': 0, 'course': 0, 'cradle': 0, 'crave': 0, 'craves': 0, 'craving': 0, 'crazy': 0, 'create': 0, 'created': 0, 'creating': 0, 'creative': 0, 'creatives': 0, 'credit': 0, 'critical': 0, 'critique': 0, 'crowded': 0, 'crucial': 0, 'culprit': 0, 'culture': 3, 'curious': 0, 'current': 0, 'cursed': 0, 'customer': 0, 'cycle': 0, 'daily': 0, 'damned': 0, 'damon': 0, 'dangerous': 0, 'daniela': 0, 'dark': 0, 'data': 1, 'day': 0, 'dead': 0, 'deadline': 0, 'deal': 0, 'dealmaking': 0, 'dealt': 0, 'death': 0, 'decade': 0, 'decay': 0, 'december': 0, 'decent': 0, 'decided': 0, 'decision': 0, 'dedicated': 0, 'deep': 0, 'defense': 0, 'defined': 0, 'definitely': 0, 'deliberate': 2, 'demonstrating': 0, 'depressing': 0, 'depression': 0, 'depth': 1, 'derelict': 0, 'describe': 0, 'described': 0, 'describes': 0, 'description': 1, 'design': 0, 'designing': 1, 'desired': 1, 'despite': 0, 'destination': 0, 'destroy': 0, 'destroyed': 0, 'destruction': 0, 'detail': 0, 'detailed': 1, 'detained': 0, 'determinant': 1, 'determination': 0, 'determined': 1, 'detract': 0, 'devastating': 0, 'developed': 0, 'development': 4, 'devil': 0, 'diabetes': 0, 'diagnostic': 0, 'diamond': 0, 'did': 4, 'die': 0, 'died': 0, 'diet': 0, 'dietary': 0, 'dieter': 0, 'differ': 0, 'difference': 0, 'different': 0, 'difficult': 0, 'digital': 0, 'dimension': 1, 'directed': 0, 'direction': 0, 'directs': 1, 'disappear': 0, 'disaster': 0, 'disavowal': 0, 'discern': 0, 'disconnected': 0, 'discover': 0, 'discovered': 0, 'discovering': 0, 'discovery': 0, 'discussed': 0, 'discussion': 1, 'disease': 0, 'disillusioned': 0, 'disorder': 0, 'dissatisfaction': 0, 'distinction': 0, 'distribute': 1, 'distribution': 0, 'dive': 0, 'divine': 0, 'dna': 0, 'do': 8, 'dock': 0, 'doctor': 0, 'doe': 0, 'doing': 1, 'dollar': 2, 'don': 0, 'donald': 0, 'done': 2, 'door': 0, 'double': 0, 'down': 0, 'drag': 0, 'drama': 0, 'dramatically': 0, 'draw': 0, 'dream': 0, 'drew': 0, 'drift': 0, 'drive': 0, 'driven': 0, 'drove': 0, 'dualist': 0, 'duct': 0, 'due': 0, 'during': 0, 'dust': 0, 'dying': 0, 'dystopian': 0, 'each': 0, 'earlier': 1, 'early': 0, 'earth': 0, 'earthquake': 0, 'easily': 1, 'easy': 0, 'eat': 1, 'eaten': 0, 'eating': 0, 'ebola': 0, 'economy': 0, 'editing': 0, 'edition': 1, 'effect': 0, 'efficient': 0, 'eg': 0, 'eight': 0, 'eighteenth': 0, 'eighty': 0, 'either': 0, 'electricity': 0, 'electron': 0, 'elegant': 0, 'eleven': 0, 'eliminated': 0, 'ellison2': 0, 'else': 0, 'email': 0, 'embed': 0, 'embrace': 0, 'emerging': 0, 'empathy': 0, 'employee': 2, 'encapsulate': 0, 'encounter': 0, 'encourage': 0, 'end': 1, 'endanger': 0, 'ended': 0, 'enders': 0, 'ending': 0, 'energy': 0, 'engaging': 0, 'engine': 0, 'engineer': 0, 'engineered': 0, 'engineering': 0, 'england': 0, 'english': 0, 'enjoy': 0, 'enjoyed': 0, 'enough': 0, 'enroll': 1, 'entered': 0, 'entering': 0, 'entirely': 0, 'entrepreneur': 0, 'entrepreneurship': 0, 'entry': 0, 'envy': 0, 'ephemeral': 0, 'epic': 0, 'epidemic': 0, 'epistemological': 0, 'equivalent': 0, 'era': 0, 'eradicate': 0, 'ere': 0, 'eric': 0, 'ericsson': 1, 'erik': 0, 'error': 1, 'especially': 0, 'esque': 0, 'establishment': 0, 'estimated': 0, 'etc': 0, 'etienne': 0, 'europe': 0, 'evaluation': 2, 'even': 4, 'event': 0, 'eventually': 0, 'ever': 0, 'every': 1, 'everyone': 1, 'everything': 0, 'evidence': 0, 'evil': 0, 'evolution': 0, 'example': 1, 'examples': 1, 'excellence': 0, 'excellent': 0, 'except': 0, 'exception': 0, 'exceptional': 0, 'excess': 0, 'exciting': 0, 'excrete': 0, 'excuse': 0, 'exec': 0, 'executive': 0, 'exercise': 0, 'exercising': 0, 'existence': 0, 'expect': 0, 'expecting': 0, 'expend': 0, 'experience': 0, 'experiencing': 0, 'experiment': 0, 'experimentation': 2, 'explain': 0, 'explained': 0, 'explaining': 1, 'explains': 0, 'explanation': 0, 'explorer': 0, 'explores': 0, 'external': 0, 'externally': 0, 'eyed': 0, 'face': 0, 'fact': 0, 'factor': 0, 'fade': 0, 'fail': 0, 'failure': 0, 'fair': 0, 'fairly': 1, 'fall': 0, 'falling': 0, 'false': 0, 'family': 0, 'famous': 0, 'far': 0, 'fascinating': 0, 'fast': 0, 'fat': 0, 'fathersdream': 0, 'favorite': 4, 'fear': 0, 'feasibility': 0, 'feature': 0, 'featuring': 0, 'feedback': 2, 'feel': 0, 'feeling': 0, 'felt': 0, 'fend': 0, 'few': 0, 'fewer': 0, 'fiber': 0, 'fiction': 0, 'fifth': 0, 'fifty': 0, 'figure': 0, 'fill': 0, 'finally': 0, 'financial': 1, 'find': 1, 'finding': 0, 'fine': 1, 'finite': 1, 'firework': 0, 'first': 0, 'fleeting': 0, 'flew': 0, 'flood': 0, 'flower': 0, 'flu': 0, 'fly': 0, 'focus': 1, 'focusing': 1, 'folding': 0, 'follow': 0, 'followed': 0, 'follows': 0, 'food': 1, 'foot': 0, 'for': 5, 'foreshadowed': 0, 'forged': 0, 'forget': 1, 'form': 0, 'former': 0, 'formulation': 0, 'forth': 1, 'forward': 0, 'found': 2, 'founder': 0, 'founding': 0, 'fragile': 0, 'fragment': 0, 'framework': 0, 'france': 0, 'frantic': 0, 'fred': 0, 'free': 0, 'freedom': 0, 'freeing': 0, 'french': 0, 'freya': 0, 'friend': 0, 'friends': 0, 'from': 5, 'front': 0, 'frozen': 0, 'fructose': 0, 'fruit': 0, 'fuel': 0, 'full': 0, 'fully': 0, 'fun': 0, 'function': 0, 'functionality': 0, 'fundamentally': 0, 'funnel': 1, 'future': 1, 'fuzzy': 0, 'g2g': 1, 'gadget': 0, 'gaiman': 0, 'game': 0, 'gasoline': 0, 'gathered': 0, 'gatherer': 0, 'gathering': 0, 'gave': 1, 'geared': 0, 'general': 0, 'generally': 0, 'generation': 0, 'genetically': 0, 'genius': 1, 'gentlemen': 0, 'georgia': 0, 'german': 0, 'get': 2, 'getting': 0, 'ghost': 0, 'gift': 0, 'girl': 0, 'give': 1, 'giveaway': 0, 'given': 1, 'giving': 2, 'glad': 0, 'glucose': 0, 'go': 0, 'goal': 0, 'god': 0, 'going': 1, 'golf': 1, 'gone': 0, 'good': 1, 'goodness': 0, 'goodreads': 2, 'google': 4, 'googlers': 2, 'got': 0, 'government': 0, 'gpu': 0, 'grade': 0, 'gradually': 0, 'grain': 0, 'grand': 1, 'gratitude': 0, 'great': 4, 'greater': 0, 'greatest': 0, 'greatly': 0, 'grit': 0, 'grocery': 0, 'grounded': 0, 'group': 0, 'grow': 2, 'growing': 0, 'grows': 0, 'growth': 0, 'guess': 0, 'guessing': 0, 'guest': 0, 'guidance': 0, 'gun': 0, 'gunpowder': 0, 'ha': 2, 'hacked': 0, 'had': 1, 'hair': 0, 'half': 0, 'halting': 0, 'hammer': 0, 'hand': 0, 'happen': 0, 'happened': 0, 'happening': 0, 'happens': 0, 'happier': 1, 'happiness': 0, 'happy': 1, 'hard': 0, 'hardship': 0, 'harmful': 0, 'harmless': 0, 'hat': 0, 'have': 7, 'having': 2, 'he': 4, 'head': 1, 'heady': 0, 'healing': 0, 'health': 0, 'healthier': 2, 'healthy': 0, 'hear': 0, 'heart': 0, 'heating': 0, 'heavily': 0, 'held': 0, 'help': 1, 'helped': 0, 'helping': 1, 'her': 0, 'here': 2, 'hey': 0, 'high': 0, 'highlight': 0, 'highly': 0, 'hilarious': 0, 'him': 0, 'himself': 0, 'hire': 0, 'hiring': 2, 'his': 3, 'historian': 0, 'historical': 0, 'history': 0, 'hit': 0, 'hitting': 1, 'hole': 0, 'hollywood': 0, 'honest': 0, 'hope': 0, 'hopefully': 0, 'hostile': 0, 'hot': 0, 'house': 0, 'household': 0, 'how': 14, 'however': 0, 'hr': 1, 'http': 0, 'hugh': 0, 'hugo': 0, 'human': 2, 'humanity': 0, 'humor': 0, 'hundred': 0, 'hunter': 0, 'idea': 0, 'ideally': 1, 'identified': 0, 'identify': 0, 'identifying': 1, 'if': 3, 'ignorance': 0, 'ignored': 0, 'ignoring': 0, 'illegal': 0, 'imagine': 0, 'immediate': 1, 'immoral': 0, 'impact': 0, 'imperfect': 0, 'impermanent': 0, 'implicated': 0, 'implied': 0, 'importance': 0, 'important': 1, 'imprecise': 0, 'impressive': 4, 'improve': 1, 'improved': 0, 'improves': 1, 'improving': 1, 'in': 18, 'inbox': 0, 'included': 0, 'includes': 0, 'including': 0, 'income': 1, 'increase': 1, 'increased': 0, 'incredibly': 1, 'indeed': 0, 'independence': 0, 'independent': 0, 'indian': 0, 'indicator': 0, 'individually': 0, 'industry': 0, 'inevitable': 0, 'inevitably': 0, 'inexplicable': 0, 'infinite': 0, 'info': 0, 'information': 0, 'infrastructure': 0, 'ingrained': 0, 'innovation': 0, 'inside': 1, 'insight': 0, 'insightful': 0, 'insights': 1, 'inspirational': 1, 'inspiring': 2, 'instance': 0, 'instantaneously': 0, 'instead': 0, 'instruction': 0, 'instrument': 0, 'insufficient': 0, 'insulin': 0, 'integrate': 1, 'intelligence': 0, 'intensely': 0, 'intensify': 0, 'intentional': 1, 'interaction': 0, 'interested': 0, 'interesting': 1, 'interestingly': 0, 'intermixing': 0, 'internal': 0, 'internally': 0, 'internet': 0, 'interview': 0, 'into': 1, 'intricate': 0, 'intuitive': 0, 'invent': 0, 'invented': 0, 'invention': 0, 'invents': 0, 'invest': 1, 'invested': 0, 'investor': 0, 'invisible': 0, 'involve': 0, 'involved': 0, 'ironically': 0, 'irrelevant': 0, 'is': 16, 'isolated': 0, 'isolating': 0, 'isolation': 0, 'it': 5, 'item': 0, 'itself': 0, 'james': 0, 'january': 0, 'jason': 0, 'jason2': 0, 'jeevan': 0, 'job': 2, 'join': 0, 'joining': 0, 'jounalist': 0, 'journey': 0, 'jules': 0, 'juliet': 0, 'jumbling': 0, 'jumping': 0, 'junger': 0, 'just': 2, 'justice': 0, 'kaleidoscope': 0, 'katz': 0, 'keep': 3, 'kelly': 0, 'kept': 0, 'kevin': 0, 'key': 0, 'killed': 0, 'kind': 1, 'kindle': 1, 'kingdom': 0, 'kitchen': 1, 'knew': 0, 'knock': 0, 'knocked': 0, 'know': 2, 'knowing': 0, 'knowledge': 1, 'kyle': 0, 'labeled': 0, 'labor': 0, 'labour': 0, 'lack': 0, 'lacked': 0, 'lacking': 0, 'lagging': 0, 'landslide': 0, 'language': 0, 'large': 0, 'largely': 0, 'larger': 0, 'largest': 0, 'larson': 0, 'last': 0, 'laszlo': 3, 'late': 0, 'later': 0, 'laure': 0, 'law': 0, 'lay': 0, 'layering': 0, 'le': 0, 'lead': 1, 'leader': 2, 'leadership': 1, 'leading': 0, 'leagues': 0, 'learn': 1, 'learned': 1, 'learning': 2, 'learns': 0, 'leave': 1, 'leaver': 0, 'led': 1, 'left': 0, 'legacy': 0, 'legendary': 0, 'lens': 0, 'lesson': 0, 'let': 1, 'letter': 0, 'lettered': 0, 'level': 0, 'liberated': 0, 'library': 0, 'lie': 0, 'life': 2, 'lifestyle': 0, 'lifetime': 0, 'light': 0, 'like': 3, 'liked': 1, 'likely': 0, 'limited': 0, 'line': 0, 'link': 0, 'linked': 0, 'list': 2, 'listed': 1, 'listen': 0, 'listened': 0, 'listening': 0, 'literary': 0, 'little': 1, 'live': 1, 'lived': 0, 'lives': 0, 'living': 0, 'll': 0, 'lobbying': 0, 'located': 0, 'log': 0, 'logic': 0, 'logical': 0, 'long': 0, 'longest': 0, 'look': 0, 'looked': 0, 'looking': 0, 'lose': 0, 'loss': 0, 'lost': 0, 'lot': 9, 'loudcloud': 0, 'love': 0, 'loved': 1, 'low': 0, 'lower': 0, 'loyal': 0, 'lusitania': 0, 'lydia': 0, 'lyric': 0, 'machine': 0, 'made': 0, 'magic': 0, 'magical': 0, 'maiden': 0, 'main': 0, 'maintain': 0, 'major': 0, 'make': 5, 'making': 1, 'man': 0, 'manage': 0, 'managed': 0, 'management': 3, 'manager': 7, 'managing': 0, 'mandrake': 0, 'maneuver': 0, 'maniacally': 0, 'many': 1, 'marc': 0, 'marie': 0, 'mark': 0, 'market': 0, 'marketing': 1, 'mars': 0, 'match': 0, 'matcher': 0, 'matching': 0, 'material': 0, 'math': 0, 'matt': 0, 'matter': 0, 'may': 0, 'maybe': 0, 'mcgyver': 0, 'me': 1, 'mean': 0, 'meaning': 1, 'meaningful': 0, 'meaninglessness': 0, 'measure': 0, 'mechanical': 0, 'mechanism': 1, 'mediocre': 0, 'meditate': 0, 'meditation': 0, 'medium': 0, 'meet': 0, 'meeting': 1, 'member': 1, 'men': 0, 'mentioned': 0, 'merged': 0, 'mermaid': 0, 'mess': 0, 'message': 2, 'met': 0, 'metabolic': 0, 'metabook': 0, 'metaphor': 0, 'methodology': 0, 'metric': 0, 'michael': 0, 'microcosmos': 0, 'middle': 0, 'might': 0, 'million': 1, 'mind': 3, 'mindset': 0, 'miner': 0, 'miniature': 0, 'minimize': 0, 'miss': 0, 'missile': 0, 'mission': 0, 'mistake': 2, 'modeled': 0, 'modern': 1, 'moment': 0, 'money': 1, 'monitoring': 0, 'monotheism': 0, 'monotheist': 0, 'month': 0, 'moon': 0, 'moral': 0, 'more': 6, 'most': 2, 'mostly': 0, 'motivate': 1, 'motto': 0, 'move': 0, 'moved': 0, 'movie': 0, 'moving': 0, 'mt': 0, 'much': 3, 'multiple': 0, 'muscle': 0, 'musician': 0, 'must': 1, 'my': 4, 'mystery': 0, 'nail': 0, 'name': 0, 'named': 0, 'nano': 0, 'narrating': 0, 'narrative': 0, 'narrator': 0, 'nasa': 0, 'national': 0, 'native': 0, 'nature': 0, 'navigate': 0, 'nazi': 0, 'near': 0, 'nearest': 0, 'nearly': 0, 'necessarily': 0, 'necessary': 2, 'need': 1, 'neighbor': 0, 'neil': 0, 'neither': 0, 'network': 0, 'networked': 0, 'neutron': 0, 'never': 0, 'nevertheless': 0, 'new': 0, 'newbie': 1, 'newfound': 0, 'news': 0, 'next': 0, 'nice': 0, 'nicely': 0, 'night': 0, 'nineteenth': 0, 'no': 1, 'nobody': 0, 'nonfiction': 0, 'nor': 0, 'not': 1, 'notably': 0, 'notch': 0, 'note': 0, 'nothin': 0, 'nothing': 0, 'notion': 1, 'novel': 0, 'now': 1, 'npr': 0, 'nuance': 0, 'nuclear': 0, 'nudge': 2, 'nudges': 1, 'nugget': 0, 'number': 0, 'numerous': 0, 'nut': 0, 'nutritional': 0, 'nutritionist': 0, 'nutritionists': 0, 'obese': 0, 'obesity': 0, 'objective': 1, 'observation': 0, 'obvious': 0, 'odds': 0, 'of': 29, 'off': 0, 'officially': 0, 'offred': 0, 'offset': 0, 'often': 0, 'okr': 0, 'old': 0, 'on': 12, 'onboard': 1, 'onboarded': 1, 'onboarding': 1, 'once': 0, 'one': 5, 'ones': 0, 'only': 2, 'onto': 0, 'open': 0, 'operate': 0, 'operated': 0, 'operation': 0, 'operational': 0, 'operationally': 0, 'operator': 0, 'opinion': 0, 'opportunity': 1, 'opposite': 0, 'opsware': 0, 'optimize': 0, 'optimizing': 0, 'or': 6, 'order': 0, 'org': 0, 'organization': 1, 'organize': 0, 'organizing': 0, 'original': 0, 'other': 0, 'others': 1, 'ought': 0, 'ouija': 0, 'our': 0, 'ours': 1, 'ourselves': 0, 'out': 1, 'outperform': 0, 'outside': 0, 'over': 0, 'overall': 0, 'overconsumption': 0, 'overdid': 0, 'overemphasize': 0, 'overview': 0, 'overweight': 0, 'overwhelming': 0, 'ovitz': 0, 'own': 0, 'paced': 0, 'packaged': 1, 'padded': 0, 'page': 0, 'pain': 0, 'painting': 0, 'paparazzi': 0, 'paradox': 0, 'parallel': 0, 'paralyze': 0, 'paralyzed': 0, 'paramedic': 0, 'paramount': 0, 'parking': 0, 'part': 0, 'particularly': 0, 'partner': 0, 'party': 0, 'passage': 0, 'passenger': 0, 'passing': 1, 'past': 0, 'paternal': 0, 'path': 0, 'pathway': 0, 'patronizingly': 1, 'pattern': 0, 'pay': 0, 'paying': 1, 'peasant': 0, 'peer': 0, 'people': 16, 'per': 0, 'percent': 0, 'percentage': 0, 'perfect': 0, 'perfectly': 0, 'performance': 3, 'perhaps': 1, 'permanent': 0, 'perpetual': 0, 'person': 0, 'personnel': 0, 'perspective': 0, 'phase': 0, 'phenomenally': 1, 'philosophy': 0, 'phone': 0, 'phrase': 0, 'physic': 0, 'physical': 0, 'physicist': 0, 'piece': 0, 'piecemeal': 0, 'pilgrimage': 0, 'pilot': 1, 'place': 0, 'planet': 0, 'play': 0, 'played': 0, 'playing': 0, 'pleasure': 0, 'plot': 0, 'plotline': 0, 'plow': 0, 'plus': 0, 'poem': 0, 'poetic': 0, 'point': 1, 'pointed': 0, 'pointer': 0, 'pointless': 0, 'pole': 0, 'political': 0, 'politics': 0, 'polytheist': 0, 'population': 1, 'portrayal': 0, 'portraying': 0, 'possible': 0, 'possibly': 0, 'post': 0, 'potato': 0, 'potentially': 0, 'pound': 0, 'poured': 0, 'poverty': 0, 'powell': 0, 'power': 0, 'powerful': 2, 'powerless': 0, 'pp': 1, 'practice': 3, 'pre': 0, 'precisely': 0, 'predicted': 0, 'predictor': 1, 'predicts': 0, 'preferred': 0, 'pressure': 0, 'pretty': 4, 'prhase': 0, 'pride': 0, 'primitive': 0, 'principle': 0, 'print': 0, 'printer': 0, 'prior': 0, 'priority': 0, 'prism': 0, 'privileged': 0, 'proactively': 0, 'probably': 0, 'problem': 0, 'process': 0, 'processed': 0, 'processing': 0, 'product': 2, 'production': 0, 'productivity': 1, 'profit': 0, 'program': 2, 'programmer': 0, 'progress': 1, 'project': 0, 'prominently': 1, 'promotion': 1, 'proper': 0, 'property': 0, 'proton': 0, 'prove': 1, 'proven': 0, 'proverb': 0, 'provide': 0, 'provisional': 0, 'provoking': 0, 'psychology': 1, 'public': 0, 'published': 0, 'publishing': 1, 'punish': 0, 'purchased': 0, 'purely': 1, 'purpose': 2, 'pursuit': 0, 'push': 0, 'put': 0, 'putting': 1, 'quackery': 0, 'quality': 1, 'quantum': 0, 'quest': 0, 'question': 0, 'quick': 0, 'quickly': 0, 'quit': 2, 'quite': 0, 'quote': 0, 'radiation': 0, 'radio': 0, 'rain': 1, 'rap': 0, 'rare': 0, 'rarer': 0, 'rate': 1, 'rather': 1, 'ray': 0, 're': 1, 'reach': 0, 'reaction': 0, 'reactionary': 0, 'read': 1, 'reading': 0, 'real': 0, 'realize': 0, 'realized': 1, 'realizes': 0, 'really': 1, 'reason': 0, 'received': 0, 'recent': 0, 'recommend': 0, 'recommended': 0, 'recreated': 0, 'recruiting': 1, 'reduce': 1, 'reduces': 1, 'refer': 0, 'reference': 0, 'referral': 0, 'referring': 0, 'refers': 1, 'reflect': 0, 'reflection': 0, 'regardless': 0, 'regret': 0, 'regular': 1, 'reinvesting': 0, 'rejecting': 0, 'relationship': 0, 'relatively': 0, 'relevant': 1, 'relies': 0, 'religion': 0, 'rely': 0, 'remade': 0, 'remain': 0, 'remained': 0, 'remains': 0, 'remarkable': 0, 'remarkably': 0, 'reminded': 0, 'reminder': 0, 'reminds': 1, 'renaissance': 0, 'repetition': 1, 'report': 1, 'required': 0, 'research': 2, 'researcher': 0, 'resiliency': 0, 'resistance': 0, 'resonates': 0, 'resource': 1, 'respect': 0, 'responded': 0, 'responsibility': 0, 'responsible': 0, 'rest': 0, 'restlessness': 0, 'result': 3, 'resulting': 0, 'retention': 0, 'return': 0, 'review': 1, 'reviewed': 0, 'revolution': 0, 'revolutionary': 0, 'reward': 0, 'rhyme': 0, 'rich': 0, 'richness': 0, 'ride': 0, 'ridley': 0, 'right': 1, 'risk': 0, 'roadtrip': 0, 'robot': 0, 'rock': 0, 'role': 0, 'room': 0, 'root': 0, 'rooted': 0, 'rosie': 0, 'rot': 0, 'rules': 1, 'run': 1, 'ruthlessness': 0, 'ryan': 0, 'sadly': 0, 'sadness': 0, 'said': 0, 'saint': 0, 'salary': 1, 'sale': 0, 'salt': 0, 'same': 2, 'sank': 0, 'satisfied': 0, 'saturated': 0, 'save': 2, 'savvy': 0, 'say': 1, 'saying': 0, 'scale': 0, 'scaling': 0, 'scare': 0, 'scary': 0, 'scene': 0, 'science': 0, 'scientific': 0, 'scientist': 0, 'scorecard': 1, 'scott': 0, 'scourge': 0, 'scrappy': 0, 'screen': 0, 'sea': 0, 'searching': 0, 'second': 0, 'section': 0, 'see': 0, 'seeing': 0, 'seek': 0, 'seem': 1, 'seemed': 0, 'seems': 0, 'seen': 0, 'seep': 0, 'self': 0, 'send': 0, 'sense': 1, 'sent': 0, 'sentence': 0, 'separate': 2, 'sequel': 0, 'series': 0, 'server': 0, 'serves': 0, 'set': 0, 'seti': 0, 'several': 0, 'shakespeare': 0, 'shallow': 0, 'share': 0, 'shared': 0, 'she': 0, 'sheep': 0, 'shelter': 0, 'shepherd': 0, 'shift': 0, 'ship': 0, 'shipping': 0, 'short': 0, 'should': 2, 'shoulder': 0, 'show': 0, 'shower': 0, 'sick': 0, 'side': 0, 'sight': 0, 'signal': 0, 'signifiant': 0, 'significant': 1, 'significantly': 1, 'silo': 0, 'similar': 1, 'simple': 1, 'simplify': 0, 'simplifying': 0, 'simply': 0, 'singing': 0, 'single': 1, 'sink': 0, 'sitting': 0, 'situation': 0, 'six': 0, 'sixty': 0, 'skill': 2, 'sleepless': 0, 'slinghot': 0, 'slow': 0, 'slowing': 0, 'small': 2, 'smaller': 1, 'smart': 0, 'smarter': 1, 'smartest': 1, 'smashed': 0, 'snarky': 0, 'sniper': 0, 'snow': 0, 'snowballed': 0, 'so': 3, 'social': 0, 'society': 0, 'software': 0, 'sol': 0, 'solar': 0, 'soldier': 0, 'solid': 0, 'solo': 0, 'solution': 0, 'some': 1, 'someone': 2, 'something': 3, 'sometimes': 1, 'sonar': 0, 'soon': 0, 'sort': 0, 'sound': 0, 'sounding': 0, 'source': 0, 'space': 0, 'speaks': 0, 'special': 0, 'specific': 1, 'specifically': 0, 'speed': 0, 'spend': 0, 'spent': 1, 'spoiler': 0, 'spot': 0, 'spread': 0, 'st': 0, 'staff': 0, 'stand': 0, 'standing': 0, 'star': 0, 'starring': 0, 'starship': 0, 'start': 0, 'started': 0, 'state': 0, 'statement': 0, 'states': 0, 'static': 0, 'station': 0, 'statistic': 0, 'stay': 1, 'stayer': 0, 'steely': 0, 'stellar': 0, 'step': 0, 'stephenson': 0, 'sterilization': 0, 'stick': 0, 'still': 0, 'stinging': 0, 'stop': 0, 'stopped': 0, 'stored': 0, 'story': 2, 'storyline': 0, 'storyteller': 0, 'stranded': 0, 'strange': 0, 'stranglehold': 0, 'strategic': 0, 'strategy': 0, 'straw': 0, 'strength': 0, 'stretch': 0, 'strictly': 0, 'strong': 0, 'struggle': 0, 'stuck': 0, 'student': 1, 'stuff': 1, 'style': 1, 'submarine': 0, 'submerged': 0, 'subroutine': 0, 'subsidiary': 1, 'succeed': 0, 'success': 0, 'successful': 0, 'succession': 0, 'such': 0, 'suck': 0, 'sucrose': 0, 'suffered': 0, 'suffering': 0, 'sufficient': 0, 'sugar': 0, 'suggestive': 0, 'suicide': 0, 'suited': 1, 'sunk': 0, 'supplemented': 0, 'supply': 0, 'supporting': 1, 'suppose': 1, 'sure': 0, 'surfer': 0, 'surfing': 0, 'surplus': 0, 'surprise': 2, 'surprised': 1, 'surrender': 0, 'survey': 1, 'survival': 0, 'survives': 0, 'surviving': 0, 'swear': 0, 'sweat': 0, 'sweet': 1, 'switch': 0, 'symphony': 0, 'synaptically': 0, 'syrup': 0, 'system': 1, 'systems': 0, 'table': 0, 'tail': 1, 'take': 0, 'takeaway': 1, 'taken': 1, 'taking': 1, 'talk': 0, 'talked': 0, 'talking': 0, 'tape': 0, 'task': 1, 'taste': 0, 'tau': 0, 'tea': 0, 'teach': 2, 'teacher': 0, 'team': 2, 'tech': 0, 'technical': 0, 'technically': 0, 'technological': 0, 'technology': 0, 'telegraph': 0, 'tell': 0, 'temporary': 0, 'ten': 0, 'tend': 0, 'tendency': 0, 'tends': 0, 'tension': 0, 'term': 0, 'terrifying': 0, 'test': 1, 'tested': 1, 'testing': 1, 'text': 0, 'than': 3, 'thanks': 0, 'that': 13, 'the': 39, 'thee': 0, 'their': 11, 'them': 4, 'theme': 0, 'themselves': 0, 'then': 0, 'theory': 0, 'there': 1, 'these': 2, 'they': 13, 'thing': 8, 'things': 1, 'think': 4, 'thinking': 0, 'third': 0, 'thirty': 0, 'this': 6, 'those': 1, 'thou': 0, 'though': 0, 'thought': 0, 'thoughtful': 0, 'thousand': 0, 'thread': 0, 'three': 0, 'thriller': 0, 'through': 0, 'throughout': 0, 'thrust': 0, 'thurman': 0, 'thus': 0, 'tidbit': 2, 'tie': 0, 'tiger': 1, 'till': 0, 'time': 2, 'timely': 1, 'tip': 0, 'title': 0, 'to': 38, 'today': 0, 'together': 0, 'told': 1, 'tomorrow': 0, 'ton': 0, 'too': 3, 'took': 0, 'tool': 0, 'tooth': 0, 'top': 0, 'torpedo': 0, 'torture': 0, 'totally': 0, 'tout': 0, 'towards': 1, 'town': 0, 'toxic': 0, 'toxin': 0, 'track': 0, 'tracking': 0, 'trade': 0, 'traditional': 1, 'traditionally': 0, 'trained': 1, 'training': 1, 'transform': 1, 'translated': 0, 'transmitter': 0, 'transparency': 0, 'travel': 0, 'traveled': 0, 'traveling': 0, 'treated': 0, 'tree': 0, 'trend': 0, 'trending': 0, 'tribe': 0, 'trip': 0, 'trisolaran': 0, 'troop': 0, 'trouble': 0, 'true': 1, 'truly': 0, 'trump': 0, 'trust': 0, 'trusting': 0, 'truth': 0, 'try': 1, 'trying': 0, 'tune': 1, 'turn': 1, 'turned': 0, 'tv': 0, 'two': 3, 'typically': 0, 'ubiquitous': 0, 'uk': 0, 'ultimate': 0, 'umbrella': 0, 'unavoidably': 0, 'uncharted': 0, 'uncle': 0, 'under': 0, 'underlined': 0, 'understand': 0, 'underwater': 0, 'unemployment': 0, 'unfolded': 0, 'unique': 0, 'uniquely': 0, 'united': 0, 'unity': 0, 'universal': 0, 'universe': 0, 'unknown': 0, 'unlike': 0, 'unsolvable': 0, 'unveiled': 0, 'up': 1, 'upbeat': 0, 'upon': 0, 'us': 0, 'use': 0, 'used': 1, 'useful': 0, 'user': 0, 'usher': 0, 'using': 0, 'usual': 0, 'usually': 0, 'utterly': 0, 'vacuum': 0, 'vague': 0, 'value': 0, 'vanished': 0, 'variety': 0, 'various': 0, 'vary': 1, 'vastly': 0, 'vcs': 0, 've': 2, 'very': 1, 'viewed': 0, 'vigilant': 0, 'vindicate': 0, 'virtuous': 0, 'virus': 0, 'vision': 0, 'visionary': 1, 'visualization': 0, 'vivid': 0, 'vote': 0, 'vr': 0, 'wa': 11, 'waiting': 0, 'walk': 0, 'want': 2, 'wanted': 0, 'war': 0, 'warfare': 0, 'warning': 0, 'was': 0, 'wasteland': 0, 'watch': 0, 'water': 0, 'watney': 0, 'wave': 0, 'way': 0, 'we': 11, 'weak': 0, 'weakness': 0, 'wealth': 1, 'wealthier': 0, 'wealthy': 0, 'weapon': 0, 'weave': 0, 'weigh': 0, 'weir': 0, 'welfare': 0, 'well': 1, 'went': 0, 'were': 3, 'werner': 0, 'western': 0, 'what': 1, 'whatever': 0, 'when': 3, 'whenever': 0, 'where': 1, 'whereas': 0, 'whether': 1, 'which': 3, 'while': 2, 'whiny': 0, 'whip': 0, 'white': 0, 'who': 4, 'whole': 0, 'why': 1, 'widely': 1, 'widespread': 0, 'wife': 0, 'will': 3, 'willful': 0, 'wilt': 0, 'wind': 0, 'winner': 0, 'winning': 0, 'wipe': 0, 'wired': 0, 'with': 2, 'within': 0, 'without': 0, 'wizard': 1, 'wo': 0, 'woman': 0, 'won': 0, 'wonder': 0, 'wool': 0, 'word': 0, 'work': 5, 'worker': 0, 'working': 0, 'world': 0, 'worrying': 0, 'worse': 0, 'worshiped': 0, 'worst': 0, 'worth': 0, 'worthwhile': 0, 'would': 4, 'wove': 0, 'wow': 0, 'write': 0, 'writing': 0, 'written': 1, 'wrong': 0, 'wrote': 0, 'ww1': 0, 'wwi': 0, 'wwii': 0, 'www': 0, 'year': 1, 'yes': 0, 'yet': 1, 'you': 5, 'young': 1, 'your': 2, 'yourself': 0, 'zero': 0, 'zooming': 0}"
