user_reviews,user_rating,review_text,days_since_review,popular,rating_diff,quote,review_length,sentiment_probabilities,lemmatized_text,countvectorized_data
218,5,"This is a special book. It started slow for about the first third, then in the middle third it started to get interesting, then the last third blew my mind. This is what I love about good science fiction - it pushes your thinking about where things can go. 
 It is a 2015 Hugo winner, and translated from its original Chinese, which made it interesting in just a different way from most things I've read. For instance the intermixing of Chinese revolutionary history - how they kept accusing people of being ""reactionaries"", etc. 
 It is a book about science, and aliens. The science described in the book is impressive - its a book grounded in physics and pretty accurate as far as I could tell. Though when it got to folding protons into 8 dimensions I think he was just making stuff up - interesting to think about though. 
 But what would happen if our SETI stations received a message - if we found someone was out there - and the person monitoring and answering the signal on our side was disillusioned? That part of the book was a bit dark - I would like to think human reaction to discovering alien civilization that is hostile would be more like Enders Game where we would band together. 
 I did like how the book unveiled the Trisolaran culture through the game. It was a smart way to build empathy with them and also understand what they've gone through across so many centuries. And who know a 3 body problem was an unsolvable math problem? But I still don't get who made the game - maybe that will come in the next book. 
 I loved this quote: 
 ""In the long history of scientific progress, how many protons have been smashed apart in accelerators by physicists? How many neutrons and electrons? Probably no fewer than a hundred million. Every collision was probably the end of the civilizations and intelligences in a microcosmos. In fact, even in nature, the destruction of universes must be happening at every second--for example, through the decay of neutrons. Also, a high-energy cosmic ray entering the atmosphere may destroy thousands of such miniature universes....""",96,1,0.9900000000000002,True,2086,0.3890340030193329,"This is a special book . It started slow for about the first third , then in the middle third it started to get interesting , then the last third blew my mind . This is what I love about good science fiction - it push your thinking about where thing can go . It is a 2015 Hugo winner , and translated from it original Chinese , which made it interesting in just a different way from most thing I 've read . For instance the intermixing of Chinese revolutionary history - how they kept accusing people of being `` reactionary '' , etc . It is a book about science , and alien . The science described in the book is impressive - it a book grounded in physic and pretty accurate a far a I could tell . Though when it got to folding proton into 8 dimension I think he wa just making stuff up - interesting to think about though . But what would happen if our SETI station received a message - if we found someone wa out there - and the person monitoring and answering the signal on our side wa disillusioned ? That part of the book wa a bit dark - I would like to think human reaction to discovering alien civilization that is hostile would be more like Enders Game where we would band together . I did like how the book unveiled the Trisolaran culture through the game . It wa a smart way to build empathy with them and also understand what they 've gone through across so many century . And who know a 3 body problem wa an unsolvable math problem ? But I still do n't get who made the game - maybe that will come in the next book . I loved this quote : `` In the long history of scientific progress , how many proton have been smashed apart in accelerator by physicist ? How many neutron and electron ? Probably no fewer than a hundred million . Every collision wa probably the end of the civilization and intelligence in a microcosmos . In fact , even in nature , the destruction of universe must be happening at every second -- for example , through the decay of neutron . Also , a high-energy cosmic ray entering the atmosphere may destroy thousand of such miniature universe .... ''","{'000': 0, '04': 0, '07': 0, '09': 0, '10': 0, '100': 0, '11': 0, '1200': 0, '1500': 0, '17': 0, '1945': 0, '1970s': 0, '1985': 0, '20': 0, '200': 0, '2009': 0, '2015': 1, '2016': 0, '2017': 0, '20k': 0, '340': 0, '341': 0, '3d': 0, '3rd': 0, '40': 0, '400': 0, '401k': 0, '4am': 0, '4th': 0, '50': 0, '500': 0, '5013826': 0, '550': 0, '60': 0, '70': 0, '800': 0, '99': 0, 'a16z': 0, 'ability': 0, 'able': 0, 'about': 5, 'above': 0, 'absolutely': 0, 'absorbed': 0, 'accelerator': 1, 'accomplished': 0, 'according': 0, 'account': 0, 'accumulate': 0, 'accumulated': 0, 'accumulating': 0, 'accuracy': 0, 'accurate': 1, 'accusing': 1, 'achieved': 0, 'acquire': 0, 'acquired': 0, 'acquisition': 0, 'across': 1, 'action': 0, 'actionable': 0, 'activity': 0, 'actor': 0, 'actual': 0, 'actually': 0, 'ad': 0, 'adage': 0, 'add': 0, 'adding': 0, 'additional': 0, 'address': 0, 'adhere': 0, 'admired': 0, 'admit': 0, 'admittedly': 0, 'adopting': 0, 'adult': 0, 'advance': 0, 'advertised': 0, 'advice': 0, 'advisor': 0, 'affect': 0, 'afraid': 0, 'after': 0, 'afterwards': 0, 'again': 0, 'against': 0, 'age': 0, 'agents': 0, 'ago': 0, 'agree': 0, 'agricultural': 0, 'ai': 0, 'aim': 0, 'airforce': 0, 'airplane': 0, 'alfred': 0, 'algorithm': 0, 'alien': 2, 'alive': 0, 'all': 0, 'alliteration': 0, 'allocation': 0, 'allows': 0, 'alluded': 0, 'almost': 0, 'already': 0, 'also': 2, 'always': 0, 'am': 0, 'amanda': 0, 'amazing': 0, 'amazon': 0, 'amazons': 0, 'ambition': 0, 'america': 0, 'american': 0, 'americans': 0, 'amount': 0, 'an': 1, 'analog': 0, 'analogy': 0, 'analysis': 0, 'analyzes': 0, 'and': 9, 'andreeson': 0, 'animist': 0, 'anna': 0, 'announcement': 0, 'annual': 0, 'anonymity': 0, 'another': 0, 'answer': 0, 'answering': 1, 'antithesis': 0, 'any': 0, 'anymore': 0, 'anyone': 0, 'anything': 0, 'anyways': 0, 'anywhere': 0, 'apart': 1, 'apocalyptic': 0, 'appeal': 0, 'appealed': 0, 'applicable': 0, 'apply': 0, 'appreciation': 0, 'approve': 0, 'ar': 0, 'are': 0, 'area': 0, 'argues': 0, 'argument': 0, 'army': 0, 'around': 0, 'arrive': 0, 'art': 0, 'arthur': 0, 'artificial': 0, 'artist': 0, 'as': 0, 'ask': 0, 'asking': 0, 'aspire': 0, 'associated': 0, 'asteriod': 0, 'astounding': 0, 'astronaut': 0, 'astute': 0, 'at': 1, 'atmosphere': 1, 'attention': 0, 'attitude': 0, 'atwood': 0, 'audible': 0, 'audio': 0, 'aunt': 0, 'author': 0, 'authority': 0, 'automation': 0, 'autonomy': 0, 'avail': 0, 'average': 0, 'avoid': 0, 'aware': 0, 'away': 0, 'awesome': 0, 'back': 0, 'backbone': 0, 'backstory': 0, 'backward': 0, 'bad': 0, 'badass': 0, 'balance': 0, 'ball': 0, 'band': 1, 'based': 0, 'basic': 0, 'basically': 0, 'basing': 0, 'basis': 0, 'bathtub': 0, 'battery': 0, 'battle': 0, 'be': 2, 'bea': 0, 'bear': 0, 'beautiful': 0, 'became': 0, 'because': 0, 'become': 0, 'becomes': 0, 'becoming': 0, 'been': 1, 'beet': 0, 'befell': 0, 'before': 0, 'beginning': 0, 'behave': 0, 'behavior': 0, 'behind': 0, 'being': 1, 'belief': 0, 'believe': 0, 'believed': 0, 'belonging': 0, 'below': 0, 'ben': 0, 'benefit': 0, 'best': 0, 'better': 0, 'between': 0, 'bi': 0, 'biasing': 0, 'big': 0, 'bigger': 0, 'biggest': 0, 'billion': 0, 'binding': 0, 'bit': 1, 'black': 0, 'blame': 0, 'blew': 1, 'blind': 0, 'blitz': 0, 'blog': 0, 'blood': 0, 'blow': 0, 'blowingly': 0, 'blue': 0, 'board': 0, 'boat': 0, 'bock': 0, 'body': 1, 'boiled': 0, 'bond': 0, 'bonding': 0, 'bonus': 0, 'book': 7, 'born': 0, 'botanist': 0, 'botany': 0, 'both': 0, 'bots': 0, 'bracket': 0, 'brain': 0, 'branch': 0, 'bravest': 0, 'bread': 0, 'breath': 0, 'breed': 0, 'brilliant': 0, 'bring': 0, 'brings': 0, 'brink': 0, 'britain': 0, 'british': 0, 'broadly': 0, 'broken': 0, 'brought': 0, 'bucket': 0, 'buddhism': 0, 'buddhist': 0, 'buddy': 0, 'build': 1, 'building': 0, 'built': 0, 'bullet': 0, 'bunch': 0, 'burn': 0, 'business': 0, 'but': 2, 'buy': 0, 'by': 1, 'ca': 0, 'caa': 0, 'cable': 0, 'calculation': 0, 'call': 0, 'called': 0, 'calorie': 0, 'came': 0, 'can': 1, 'cancer': 0, 'candidate': 0, 'canvas': 0, 'capitalism': 0, 'caput': 0, 'car': 0, 'caravan': 0, 'carb': 0, 'care': 0, 'career': 0, 'carry': 0, 'case': 0, 'casualty': 0, 'catastrophe': 0, 'catch': 0, 'cause': 0, 'caused': 0, 'celebrity': 0, 'central': 0, 'century': 1, 'ceo': 0, 'ceos': 0, 'certain': 0, 'certainly': 0, 'ceti': 0, 'challenge': 0, 'change': 0, 'chaos': 0, 'chapter': 0, 'character': 0, 'chart': 0, 'chase': 0, 'chasing': 0, 'chatter': 0, 'cheap': 0, 'cheat': 0, 'check': 0, 'checklist': 0, 'chemistry': 0, 'chess': 0, 'child': 0, 'chilling': 0, 'chillingly': 0, 'china': 0, 'chinese': 2, 'choice': 0, 'christian': 0, 'chuang': 0, 'citing': 0, 'civilian': 0, 'civilization': 2, 'classic': 0, 'clean': 0, 'clear': 0, 'cleared': 0, 'clearly': 0, 'cleft': 0, 'climate': 0, 'close': 0, 'clothing': 0, 'cnn': 0, 'co': 0, 'cofounder': 0, 'cognition': 0, 'cold': 0, 'colin': 0, 'collapse': 0, 'collective': 0, 'college': 0, 'collision': 1, 'colonize': 0, 'color': 0, 'com': 0, 'combination': 0, 'combine': 0, 'combo': 0, 'combustion': 0, 'come': 1, 'coming': 0, 'commander': 0, 'committee': 0, 'commodity': 0, 'commonplace': 0, 'communal': 0, 'communication': 0, 'community': 0, 'companion': 0, 'company': 0, 'compared': 0, 'compelling': 0, 'compensation': 0, 'compete': 0, 'complaint': 0, 'complete': 0, 'completely': 0, 'complex': 0, 'comprehensive': 0, 'compromise': 0, 'computer': 0, 'concentrated': 0, 'concept': 0, 'concludes': 0, 'conclusion': 0, 'conclusive': 0, 'confidence': 0, 'congratulatory': 0, 'connect': 0, 'connected': 0, 'connection': 0, 'consciousness': 0, 'consider': 0, 'consistent': 0, 'constant': 0, 'consume': 0, 'consumed': 0, 'consumption': 0, 'contains': 0, 'content': 0, 'continent': 0, 'continue': 0, 'continuously': 0, 'contrary': 0, 'contrast': 0, 'control': 0, 'conventional': 0, 'conversation': 0, 'conversely': 0, 'convince': 0, 'cool': 0, 'cooperation': 0, 'core': 0, 'corn': 0, 'coronary': 0, 'correction': 0, 'correctly': 0, 'correlated': 0, 'cosmic': 1, 'cost': 0, 'could': 1, 'count': 0, 'course': 0, 'cradle': 0, 'crave': 0, 'craves': 0, 'craving': 0, 'crazy': 0, 'create': 0, 'created': 0, 'creating': 0, 'creative': 0, 'creatives': 0, 'credit': 0, 'critical': 0, 'critique': 0, 'crowded': 0, 'crucial': 0, 'culprit': 0, 'culture': 1, 'curious': 0, 'current': 0, 'cursed': 0, 'customer': 0, 'cycle': 0, 'daily': 0, 'damned': 0, 'damon': 0, 'dangerous': 0, 'daniela': 0, 'dark': 1, 'data': 0, 'day': 0, 'dead': 0, 'deadline': 0, 'deal': 0, 'dealmaking': 0, 'dealt': 0, 'death': 0, 'decade': 0, 'decay': 1, 'december': 0, 'decent': 0, 'decided': 0, 'decision': 0, 'dedicated': 0, 'deep': 0, 'defense': 0, 'defined': 0, 'definitely': 0, 'deliberate': 0, 'demonstrating': 0, 'depressing': 0, 'depression': 0, 'depth': 0, 'derelict': 0, 'describe': 0, 'described': 1, 'describes': 0, 'description': 0, 'design': 0, 'designing': 0, 'desired': 0, 'despite': 0, 'destination': 0, 'destroy': 1, 'destroyed': 0, 'destruction': 1, 'detail': 0, 'detailed': 0, 'detained': 0, 'determinant': 0, 'determination': 0, 'determined': 0, 'detract': 0, 'devastating': 0, 'developed': 0, 'development': 0, 'devil': 0, 'diabetes': 0, 'diagnostic': 0, 'diamond': 0, 'did': 1, 'die': 0, 'died': 0, 'diet': 0, 'dietary': 0, 'dieter': 0, 'differ': 0, 'difference': 0, 'different': 1, 'difficult': 0, 'digital': 0, 'dimension': 1, 'directed': 0, 'direction': 0, 'directs': 0, 'disappear': 0, 'disaster': 0, 'disavowal': 0, 'discern': 0, 'disconnected': 0, 'discover': 0, 'discovered': 0, 'discovering': 1, 'discovery': 0, 'discussed': 0, 'discussion': 0, 'disease': 0, 'disillusioned': 1, 'disorder': 0, 'dissatisfaction': 0, 'distinction': 0, 'distribute': 0, 'distribution': 0, 'dive': 0, 'divine': 0, 'dna': 0, 'do': 1, 'dock': 0, 'doctor': 0, 'doe': 0, 'doing': 0, 'dollar': 0, 'don': 0, 'donald': 0, 'done': 0, 'door': 0, 'double': 0, 'down': 0, 'drag': 0, 'drama': 0, 'dramatically': 0, 'draw': 0, 'dream': 0, 'drew': 0, 'drift': 0, 'drive': 0, 'driven': 0, 'drove': 0, 'dualist': 0, 'duct': 0, 'due': 0, 'during': 0, 'dust': 0, 'dying': 0, 'dystopian': 0, 'each': 0, 'earlier': 0, 'early': 0, 'earth': 0, 'earthquake': 0, 'easily': 0, 'easy': 0, 'eat': 0, 'eaten': 0, 'eating': 0, 'ebola': 0, 'economy': 0, 'editing': 0, 'edition': 0, 'effect': 0, 'efficient': 0, 'eg': 0, 'eight': 0, 'eighteenth': 0, 'eighty': 0, 'either': 0, 'electricity': 0, 'electron': 1, 'elegant': 0, 'eleven': 0, 'eliminated': 0, 'ellison2': 0, 'else': 0, 'email': 0, 'embed': 0, 'embrace': 0, 'emerging': 0, 'empathy': 1, 'employee': 0, 'encapsulate': 0, 'encounter': 0, 'encourage': 0, 'end': 1, 'endanger': 0, 'ended': 0, 'enders': 1, 'ending': 0, 'energy': 1, 'engaging': 0, 'engine': 0, 'engineer': 0, 'engineered': 0, 'engineering': 0, 'england': 0, 'english': 0, 'enjoy': 0, 'enjoyed': 0, 'enough': 0, 'enroll': 0, 'entered': 0, 'entering': 1, 'entirely': 0, 'entrepreneur': 0, 'entrepreneurship': 0, 'entry': 0, 'envy': 0, 'ephemeral': 0, 'epic': 0, 'epidemic': 0, 'epistemological': 0, 'equivalent': 0, 'era': 0, 'eradicate': 0, 'ere': 0, 'eric': 0, 'ericsson': 0, 'erik': 0, 'error': 0, 'especially': 0, 'esque': 0, 'establishment': 0, 'estimated': 0, 'etc': 1, 'etienne': 0, 'europe': 0, 'evaluation': 0, 'even': 1, 'event': 0, 'eventually': 0, 'ever': 0, 'every': 2, 'everyone': 0, 'everything': 0, 'evidence': 0, 'evil': 0, 'evolution': 0, 'example': 1, 'examples': 0, 'excellence': 0, 'excellent': 0, 'except': 0, 'exception': 0, 'exceptional': 0, 'excess': 0, 'exciting': 0, 'excrete': 0, 'excuse': 0, 'exec': 0, 'executive': 0, 'exercise': 0, 'exercising': 0, 'existence': 0, 'expect': 0, 'expecting': 0, 'expend': 0, 'experience': 0, 'experiencing': 0, 'experiment': 0, 'experimentation': 0, 'explain': 0, 'explained': 0, 'explaining': 0, 'explains': 0, 'explanation': 0, 'explorer': 0, 'explores': 0, 'external': 0, 'externally': 0, 'eyed': 0, 'face': 0, 'fact': 1, 'factor': 0, 'fade': 0, 'fail': 0, 'failure': 0, 'fair': 0, 'fairly': 0, 'fall': 0, 'falling': 0, 'false': 0, 'family': 0, 'famous': 0, 'far': 1, 'fascinating': 0, 'fast': 0, 'fat': 0, 'fathersdream': 0, 'favorite': 0, 'fear': 0, 'feasibility': 0, 'feature': 0, 'featuring': 0, 'feedback': 0, 'feel': 0, 'feeling': 0, 'felt': 0, 'fend': 0, 'few': 0, 'fewer': 1, 'fiber': 0, 'fiction': 1, 'fifth': 0, 'fifty': 0, 'figure': 0, 'fill': 0, 'finally': 0, 'financial': 0, 'find': 0, 'finding': 0, 'fine': 0, 'finite': 0, 'firework': 0, 'first': 1, 'fleeting': 0, 'flew': 0, 'flood': 0, 'flower': 0, 'flu': 0, 'fly': 0, 'focus': 0, 'focusing': 0, 'folding': 1, 'follow': 0, 'followed': 0, 'follows': 0, 'food': 0, 'foot': 0, 'for': 3, 'foreshadowed': 0, 'forged': 0, 'forget': 0, 'form': 0, 'former': 0, 'formulation': 0, 'forth': 0, 'forward': 0, 'found': 1, 'founder': 0, 'founding': 0, 'fragile': 0, 'fragment': 0, 'framework': 0, 'france': 0, 'frantic': 0, 'fred': 0, 'free': 0, 'freedom': 0, 'freeing': 0, 'french': 0, 'freya': 0, 'friend': 0, 'friends': 0, 'from': 2, 'front': 0, 'frozen': 0, 'fructose': 0, 'fruit': 0, 'fuel': 0, 'full': 0, 'fully': 0, 'fun': 0, 'function': 0, 'functionality': 0, 'fundamentally': 0, 'funnel': 0, 'future': 0, 'fuzzy': 0, 'g2g': 0, 'gadget': 0, 'gaiman': 0, 'game': 3, 'gasoline': 0, 'gathered': 0, 'gatherer': 0, 'gathering': 0, 'gave': 0, 'geared': 0, 'general': 0, 'generally': 0, 'generation': 0, 'genetically': 0, 'genius': 0, 'gentlemen': 0, 'georgia': 0, 'german': 0, 'get': 2, 'getting': 0, 'ghost': 0, 'gift': 0, 'girl': 0, 'give': 0, 'giveaway': 0, 'given': 0, 'giving': 0, 'glad': 0, 'glucose': 0, 'go': 1, 'goal': 0, 'god': 0, 'going': 0, 'golf': 0, 'gone': 1, 'good': 1, 'goodness': 0, 'goodreads': 0, 'google': 0, 'googlers': 0, 'got': 1, 'government': 0, 'gpu': 0, 'grade': 0, 'gradually': 0, 'grain': 0, 'grand': 0, 'gratitude': 0, 'great': 0, 'greater': 0, 'greatest': 0, 'greatly': 0, 'grit': 0, 'grocery': 0, 'grounded': 1, 'group': 0, 'grow': 0, 'growing': 0, 'grows': 0, 'growth': 0, 'guess': 0, 'guessing': 0, 'guest': 0, 'guidance': 0, 'gun': 0, 'gunpowder': 0, 'ha': 0, 'hacked': 0, 'had': 0, 'hair': 0, 'half': 0, 'halting': 0, 'hammer': 0, 'hand': 0, 'happen': 1, 'happened': 0, 'happening': 1, 'happens': 0, 'happier': 0, 'happiness': 0, 'happy': 0, 'hard': 0, 'hardship': 0, 'harmful': 0, 'harmless': 0, 'hat': 0, 'have': 1, 'having': 0, 'he': 1, 'head': 0, 'heady': 0, 'healing': 0, 'health': 0, 'healthier': 0, 'healthy': 0, 'hear': 0, 'heart': 0, 'heating': 0, 'heavily': 0, 'held': 0, 'help': 0, 'helped': 0, 'helping': 0, 'her': 0, 'here': 0, 'hey': 0, 'high': 1, 'highlight': 0, 'highly': 0, 'hilarious': 0, 'him': 0, 'himself': 0, 'hire': 0, 'hiring': 0, 'his': 0, 'historian': 0, 'historical': 0, 'history': 2, 'hit': 0, 'hitting': 0, 'hole': 0, 'hollywood': 0, 'honest': 0, 'hope': 0, 'hopefully': 0, 'hostile': 1, 'hot': 0, 'house': 0, 'household': 0, 'how': 4, 'however': 0, 'hr': 0, 'http': 0, 'hugh': 0, 'hugo': 1, 'human': 1, 'humanity': 0, 'humor': 0, 'hundred': 1, 'hunter': 0, 'idea': 0, 'ideally': 0, 'identified': 0, 'identify': 0, 'identifying': 0, 'if': 2, 'ignorance': 0, 'ignored': 0, 'ignoring': 0, 'illegal': 0, 'imagine': 0, 'immediate': 0, 'immoral': 0, 'impact': 0, 'imperfect': 0, 'impermanent': 0, 'implicated': 0, 'implied': 0, 'importance': 0, 'important': 0, 'imprecise': 0, 'impressive': 1, 'improve': 0, 'improved': 0, 'improves': 0, 'improving': 0, 'in': 10, 'inbox': 0, 'included': 0, 'includes': 0, 'including': 0, 'income': 0, 'increase': 0, 'increased': 0, 'incredibly': 0, 'indeed': 0, 'independence': 0, 'independent': 0, 'indian': 0, 'indicator': 0, 'individually': 0, 'industry': 0, 'inevitable': 0, 'inevitably': 0, 'inexplicable': 0, 'infinite': 0, 'info': 0, 'information': 0, 'infrastructure': 0, 'ingrained': 0, 'innovation': 0, 'inside': 0, 'insight': 0, 'insightful': 0, 'insights': 0, 'inspirational': 0, 'inspiring': 0, 'instance': 1, 'instantaneously': 0, 'instead': 0, 'instruction': 0, 'instrument': 0, 'insufficient': 0, 'insulin': 0, 'integrate': 0, 'intelligence': 1, 'intensely': 0, 'intensify': 0, 'intentional': 0, 'interaction': 0, 'interested': 0, 'interesting': 3, 'interestingly': 0, 'intermixing': 1, 'internal': 0, 'internally': 0, 'internet': 0, 'interview': 0, 'into': 1, 'intricate': 0, 'intuitive': 0, 'invent': 0, 'invented': 0, 'invention': 0, 'invents': 0, 'invest': 0, 'invested': 0, 'investor': 0, 'invisible': 0, 'involve': 0, 'involved': 0, 'ironically': 0, 'irrelevant': 0, 'is': 6, 'isolated': 0, 'isolating': 0, 'isolation': 0, 'it': 10, 'item': 0, 'itself': 0, 'james': 0, 'january': 0, 'jason': 0, 'jason2': 0, 'jeevan': 0, 'job': 0, 'join': 0, 'joining': 0, 'jounalist': 0, 'journey': 0, 'jules': 0, 'juliet': 0, 'jumbling': 0, 'jumping': 0, 'junger': 0, 'just': 2, 'justice': 0, 'kaleidoscope': 0, 'katz': 0, 'keep': 0, 'kelly': 0, 'kept': 1, 'kevin': 0, 'key': 0, 'killed': 0, 'kind': 0, 'kindle': 0, 'kingdom': 0, 'kitchen': 0, 'knew': 0, 'knock': 0, 'knocked': 0, 'know': 1, 'knowing': 0, 'knowledge': 0, 'kyle': 0, 'labeled': 0, 'labor': 0, 'labour': 0, 'lack': 0, 'lacked': 0, 'lacking': 0, 'lagging': 0, 'landslide': 0, 'language': 0, 'large': 0, 'largely': 0, 'larger': 0, 'largest': 0, 'larson': 0, 'last': 1, 'laszlo': 0, 'late': 0, 'later': 0, 'laure': 0, 'law': 0, 'lay': 0, 'layering': 0, 'le': 0, 'lead': 0, 'leader': 0, 'leadership': 0, 'leading': 0, 'leagues': 0, 'learn': 0, 'learned': 0, 'learning': 0, 'learns': 0, 'leave': 0, 'leaver': 0, 'led': 0, 'left': 0, 'legacy': 0, 'legendary': 0, 'lens': 0, 'lesson': 0, 'let': 0, 'letter': 0, 'lettered': 0, 'level': 0, 'liberated': 0, 'library': 0, 'lie': 0, 'life': 0, 'lifestyle': 0, 'lifetime': 0, 'light': 0, 'like': 3, 'liked': 0, 'likely': 0, 'limited': 0, 'line': 0, 'link': 0, 'linked': 0, 'list': 0, 'listed': 0, 'listen': 0, 'listened': 0, 'listening': 0, 'literary': 0, 'little': 0, 'live': 0, 'lived': 0, 'lives': 0, 'living': 0, 'll': 0, 'lobbying': 0, 'located': 0, 'log': 0, 'logic': 0, 'logical': 0, 'long': 1, 'longest': 0, 'look': 0, 'looked': 0, 'looking': 0, 'lose': 0, 'loss': 0, 'lost': 0, 'lot': 0, 'loudcloud': 0, 'love': 1, 'loved': 1, 'low': 0, 'lower': 0, 'loyal': 0, 'lusitania': 0, 'lydia': 0, 'lyric': 0, 'machine': 0, 'made': 2, 'magic': 0, 'magical': 0, 'maiden': 0, 'main': 0, 'maintain': 0, 'major': 0, 'make': 0, 'making': 1, 'man': 0, 'manage': 0, 'managed': 0, 'management': 0, 'manager': 0, 'managing': 0, 'mandrake': 0, 'maneuver': 0, 'maniacally': 0, 'many': 3, 'marc': 0, 'marie': 0, 'mark': 0, 'market': 0, 'marketing': 0, 'mars': 0, 'match': 0, 'matcher': 0, 'matching': 0, 'material': 0, 'math': 1, 'matt': 0, 'matter': 0, 'may': 1, 'maybe': 1, 'mcgyver': 0, 'me': 0, 'mean': 0, 'meaning': 0, 'meaningful': 0, 'meaninglessness': 0, 'measure': 0, 'mechanical': 0, 'mechanism': 0, 'mediocre': 0, 'meditate': 0, 'meditation': 0, 'medium': 0, 'meet': 0, 'meeting': 0, 'member': 0, 'men': 0, 'mentioned': 0, 'merged': 0, 'mermaid': 0, 'mess': 0, 'message': 1, 'met': 0, 'metabolic': 0, 'metabook': 0, 'metaphor': 0, 'methodology': 0, 'metric': 0, 'michael': 0, 'microcosmos': 1, 'middle': 1, 'might': 0, 'million': 1, 'mind': 1, 'mindset': 0, 'miner': 0, 'miniature': 1, 'minimize': 0, 'miss': 0, 'missile': 0, 'mission': 0, 'mistake': 0, 'modeled': 0, 'modern': 0, 'moment': 0, 'money': 0, 'monitoring': 1, 'monotheism': 0, 'monotheist': 0, 'month': 0, 'moon': 0, 'moral': 0, 'more': 1, 'most': 1, 'mostly': 0, 'motivate': 0, 'motto': 0, 'move': 0, 'moved': 0, 'movie': 0, 'moving': 0, 'mt': 0, 'much': 0, 'multiple': 0, 'muscle': 0, 'musician': 0, 'must': 1, 'my': 1, 'mystery': 0, 'nail': 0, 'name': 0, 'named': 0, 'nano': 0, 'narrating': 0, 'narrative': 0, 'narrator': 0, 'nasa': 0, 'national': 0, 'native': 0, 'nature': 1, 'navigate': 0, 'nazi': 0, 'near': 0, 'nearest': 0, 'nearly': 0, 'necessarily': 0, 'necessary': 0, 'need': 0, 'neighbor': 0, 'neil': 0, 'neither': 0, 'network': 0, 'networked': 0, 'neutron': 2, 'never': 0, 'nevertheless': 0, 'new': 0, 'newbie': 0, 'newfound': 0, 'news': 0, 'next': 1, 'nice': 0, 'nicely': 0, 'night': 0, 'nineteenth': 0, 'no': 1, 'nobody': 0, 'nonfiction': 0, 'nor': 0, 'not': 0, 'notably': 0, 'notch': 0, 'note': 0, 'nothin': 0, 'nothing': 0, 'notion': 0, 'novel': 0, 'now': 0, 'npr': 0, 'nuance': 0, 'nuclear': 0, 'nudge': 0, 'nudges': 0, 'nugget': 0, 'number': 0, 'numerous': 0, 'nut': 0, 'nutritional': 0, 'nutritionist': 0, 'nutritionists': 0, 'obese': 0, 'obesity': 0, 'objective': 0, 'observation': 0, 'obvious': 0, 'odds': 0, 'of': 8, 'off': 0, 'officially': 0, 'offred': 0, 'offset': 0, 'often': 0, 'okr': 0, 'old': 0, 'on': 1, 'onboard': 0, 'onboarded': 0, 'onboarding': 0, 'once': 0, 'one': 0, 'ones': 0, 'only': 0, 'onto': 0, 'open': 0, 'operate': 0, 'operated': 0, 'operation': 0, 'operational': 0, 'operationally': 0, 'operator': 0, 'opinion': 0, 'opportunity': 0, 'opposite': 0, 'opsware': 0, 'optimize': 0, 'optimizing': 0, 'or': 0, 'order': 0, 'org': 0, 'organization': 0, 'organize': 0, 'organizing': 0, 'original': 1, 'other': 0, 'others': 0, 'ought': 0, 'ouija': 0, 'our': 2, 'ours': 0, 'ourselves': 0, 'out': 1, 'outperform': 0, 'outside': 0, 'over': 0, 'overall': 0, 'overconsumption': 0, 'overdid': 0, 'overemphasize': 0, 'overview': 0, 'overweight': 0, 'overwhelming': 0, 'ovitz': 0, 'own': 0, 'paced': 0, 'packaged': 0, 'padded': 0, 'page': 0, 'pain': 0, 'painting': 0, 'paparazzi': 0, 'paradox': 0, 'parallel': 0, 'paralyze': 0, 'paralyzed': 0, 'paramedic': 0, 'paramount': 0, 'parking': 0, 'part': 1, 'particularly': 0, 'partner': 0, 'party': 0, 'passage': 0, 'passenger': 0, 'passing': 0, 'past': 0, 'paternal': 0, 'path': 0, 'pathway': 0, 'patronizingly': 0, 'pattern': 0, 'pay': 0, 'paying': 0, 'peasant': 0, 'peer': 0, 'people': 1, 'per': 0, 'percent': 0, 'percentage': 0, 'perfect': 0, 'perfectly': 0, 'performance': 0, 'perhaps': 0, 'permanent': 0, 'perpetual': 0, 'person': 1, 'personnel': 0, 'perspective': 0, 'phase': 0, 'phenomenally': 0, 'philosophy': 0, 'phone': 0, 'phrase': 0, 'physic': 1, 'physical': 0, 'physicist': 1, 'piece': 0, 'piecemeal': 0, 'pilgrimage': 0, 'pilot': 0, 'place': 0, 'planet': 0, 'play': 0, 'played': 0, 'playing': 0, 'pleasure': 0, 'plot': 0, 'plotline': 0, 'plow': 0, 'plus': 0, 'poem': 0, 'poetic': 0, 'point': 0, 'pointed': 0, 'pointer': 0, 'pointless': 0, 'pole': 0, 'political': 0, 'politics': 0, 'polytheist': 0, 'population': 0, 'portrayal': 0, 'portraying': 0, 'possible': 0, 'possibly': 0, 'post': 0, 'potato': 0, 'potentially': 0, 'pound': 0, 'poured': 0, 'poverty': 0, 'powell': 0, 'power': 0, 'powerful': 0, 'powerless': 0, 'pp': 0, 'practice': 0, 'pre': 0, 'precisely': 0, 'predicted': 0, 'predictor': 0, 'predicts': 0, 'preferred': 0, 'pressure': 0, 'pretty': 1, 'prhase': 0, 'pride': 0, 'primitive': 0, 'principle': 0, 'print': 0, 'printer': 0, 'prior': 0, 'priority': 0, 'prism': 0, 'privileged': 0, 'proactively': 0, 'probably': 2, 'problem': 2, 'process': 0, 'processed': 0, 'processing': 0, 'product': 0, 'production': 0, 'productivity': 0, 'profit': 0, 'program': 0, 'programmer': 0, 'progress': 1, 'project': 0, 'prominently': 0, 'promotion': 0, 'proper': 0, 'property': 0, 'proton': 2, 'prove': 0, 'proven': 0, 'proverb': 0, 'provide': 0, 'provisional': 0, 'provoking': 0, 'psychology': 0, 'public': 0, 'published': 0, 'publishing': 0, 'punish': 0, 'purchased': 0, 'purely': 0, 'purpose': 0, 'pursuit': 0, 'push': 1, 'put': 0, 'putting': 0, 'quackery': 0, 'quality': 0, 'quantum': 0, 'quest': 0, 'question': 0, 'quick': 0, 'quickly': 0, 'quit': 0, 'quite': 0, 'quote': 1, 'radiation': 0, 'radio': 0, 'rain': 0, 'rap': 0, 'rare': 0, 'rarer': 0, 'rate': 0, 'rather': 0, 'ray': 1, 're': 0, 'reach': 0, 'reaction': 1, 'reactionary': 1, 'read': 1, 'reading': 0, 'real': 0, 'realize': 0, 'realized': 0, 'realizes': 0, 'really': 0, 'reason': 0, 'received': 1, 'recent': 0, 'recommend': 0, 'recommended': 0, 'recreated': 0, 'recruiting': 0, 'reduce': 0, 'reduces': 0, 'refer': 0, 'reference': 0, 'referral': 0, 'referring': 0, 'refers': 0, 'reflect': 0, 'reflection': 0, 'regardless': 0, 'regret': 0, 'regular': 0, 'reinvesting': 0, 'rejecting': 0, 'relationship': 0, 'relatively': 0, 'relevant': 0, 'relies': 0, 'religion': 0, 'rely': 0, 'remade': 0, 'remain': 0, 'remained': 0, 'remains': 0, 'remarkable': 0, 'remarkably': 0, 'reminded': 0, 'reminder': 0, 'reminds': 0, 'renaissance': 0, 'repetition': 0, 'report': 0, 'required': 0, 'research': 0, 'researcher': 0, 'resiliency': 0, 'resistance': 0, 'resonates': 0, 'resource': 0, 'respect': 0, 'responded': 0, 'responsibility': 0, 'responsible': 0, 'rest': 0, 'restlessness': 0, 'result': 0, 'resulting': 0, 'retention': 0, 'return': 0, 'review': 0, 'reviewed': 0, 'revolution': 0, 'revolutionary': 1, 'reward': 0, 'rhyme': 0, 'rich': 0, 'richness': 0, 'ride': 0, 'ridley': 0, 'right': 0, 'risk': 0, 'roadtrip': 0, 'robot': 0, 'rock': 0, 'role': 0, 'room': 0, 'root': 0, 'rooted': 0, 'rosie': 0, 'rot': 0, 'rules': 0, 'run': 0, 'ruthlessness': 0, 'ryan': 0, 'sadly': 0, 'sadness': 0, 'said': 0, 'saint': 0, 'salary': 0, 'sale': 0, 'salt': 0, 'same': 0, 'sank': 0, 'satisfied': 0, 'saturated': 0, 'save': 0, 'savvy': 0, 'say': 0, 'saying': 0, 'scale': 0, 'scaling': 0, 'scare': 0, 'scary': 0, 'scene': 0, 'science': 3, 'scientific': 1, 'scientist': 0, 'scorecard': 0, 'scott': 0, 'scourge': 0, 'scrappy': 0, 'screen': 0, 'sea': 0, 'searching': 0, 'second': 1, 'section': 0, 'see': 0, 'seeing': 0, 'seek': 0, 'seem': 0, 'seemed': 0, 'seems': 0, 'seen': 0, 'seep': 0, 'self': 0, 'send': 0, 'sense': 0, 'sent': 0, 'sentence': 0, 'separate': 0, 'sequel': 0, 'series': 0, 'server': 0, 'serves': 0, 'set': 0, 'seti': 1, 'several': 0, 'shakespeare': 0, 'shallow': 0, 'share': 0, 'shared': 0, 'she': 0, 'sheep': 0, 'shelter': 0, 'shepherd': 0, 'shift': 0, 'ship': 0, 'shipping': 0, 'short': 0, 'should': 0, 'shoulder': 0, 'show': 0, 'shower': 0, 'sick': 0, 'side': 1, 'sight': 0, 'signal': 1, 'signifiant': 0, 'significant': 0, 'significantly': 0, 'silo': 0, 'similar': 0, 'simple': 0, 'simplify': 0, 'simplifying': 0, 'simply': 0, 'singing': 0, 'single': 0, 'sink': 0, 'sitting': 0, 'situation': 0, 'six': 0, 'sixty': 0, 'skill': 0, 'sleepless': 0, 'slinghot': 0, 'slow': 1, 'slowing': 0, 'small': 0, 'smaller': 0, 'smart': 1, 'smarter': 0, 'smartest': 0, 'smashed': 1, 'snarky': 0, 'sniper': 0, 'snow': 0, 'snowballed': 0, 'so': 1, 'social': 0, 'society': 0, 'software': 0, 'sol': 0, 'solar': 0, 'soldier': 0, 'solid': 0, 'solo': 0, 'solution': 0, 'some': 0, 'someone': 1, 'something': 0, 'sometimes': 0, 'sonar': 0, 'soon': 0, 'sort': 0, 'sound': 0, 'sounding': 0, 'source': 0, 'space': 0, 'speaks': 0, 'special': 1, 'specific': 0, 'specifically': 0, 'speed': 0, 'spend': 0, 'spent': 0, 'spoiler': 0, 'spot': 0, 'spread': 0, 'st': 0, 'staff': 0, 'stand': 0, 'standing': 0, 'star': 0, 'starring': 0, 'starship': 0, 'start': 0, 'started': 2, 'state': 0, 'statement': 0, 'states': 0, 'static': 0, 'station': 1, 'statistic': 0, 'stay': 0, 'stayer': 0, 'steely': 0, 'stellar': 0, 'step': 0, 'stephenson': 0, 'sterilization': 0, 'stick': 0, 'still': 1, 'stinging': 0, 'stop': 0, 'stopped': 0, 'stored': 0, 'story': 0, 'storyline': 0, 'storyteller': 0, 'stranded': 0, 'strange': 0, 'stranglehold': 0, 'strategic': 0, 'strategy': 0, 'straw': 0, 'strength': 0, 'stretch': 0, 'strictly': 0, 'strong': 0, 'struggle': 0, 'stuck': 0, 'student': 0, 'stuff': 1, 'style': 0, 'submarine': 0, 'submerged': 0, 'subroutine': 0, 'subsidiary': 0, 'succeed': 0, 'success': 0, 'successful': 0, 'succession': 0, 'such': 1, 'suck': 0, 'sucrose': 0, 'suffered': 0, 'suffering': 0, 'sufficient': 0, 'sugar': 0, 'suggestive': 0, 'suicide': 0, 'suited': 0, 'sunk': 0, 'supplemented': 0, 'supply': 0, 'supporting': 0, 'suppose': 0, 'sure': 0, 'surfer': 0, 'surfing': 0, 'surplus': 0, 'surprise': 0, 'surprised': 0, 'surrender': 0, 'survey': 0, 'survival': 0, 'survives': 0, 'surviving': 0, 'swear': 0, 'sweat': 0, 'sweet': 0, 'switch': 0, 'symphony': 0, 'synaptically': 0, 'syrup': 0, 'system': 0, 'systems': 0, 'table': 0, 'tail': 0, 'take': 0, 'takeaway': 0, 'taken': 0, 'taking': 0, 'talk': 0, 'talked': 0, 'talking': 0, 'tape': 0, 'task': 0, 'taste': 0, 'tau': 0, 'tea': 0, 'teach': 0, 'teacher': 0, 'team': 0, 'tech': 0, 'technical': 0, 'technically': 0, 'technological': 0, 'technology': 0, 'telegraph': 0, 'tell': 1, 'temporary': 0, 'ten': 0, 'tend': 0, 'tendency': 0, 'tends': 0, 'tension': 0, 'term': 0, 'terrifying': 0, 'test': 0, 'tested': 0, 'testing': 0, 'text': 0, 'than': 1, 'thanks': 0, 'that': 3, 'the': 20, 'thee': 0, 'their': 0, 'them': 1, 'theme': 0, 'themselves': 0, 'then': 2, 'theory': 0, 'there': 1, 'these': 0, 'they': 2, 'thing': 2, 'things': 0, 'think': 3, 'thinking': 1, 'third': 3, 'thirty': 0, 'this': 3, 'those': 0, 'thou': 0, 'though': 2, 'thought': 0, 'thoughtful': 0, 'thousand': 1, 'thread': 0, 'three': 0, 'thriller': 0, 'through': 3, 'throughout': 0, 'thrust': 0, 'thurman': 0, 'thus': 0, 'tidbit': 0, 'tie': 0, 'tiger': 0, 'till': 0, 'time': 0, 'timely': 0, 'tip': 0, 'title': 0, 'to': 6, 'today': 0, 'together': 1, 'told': 0, 'tomorrow': 0, 'ton': 0, 'too': 0, 'took': 0, 'tool': 0, 'tooth': 0, 'top': 0, 'torpedo': 0, 'torture': 0, 'totally': 0, 'tout': 0, 'towards': 0, 'town': 0, 'toxic': 0, 'toxin': 0, 'track': 0, 'tracking': 0, 'trade': 0, 'traditional': 0, 'traditionally': 0, 'trained': 0, 'training': 0, 'transform': 0, 'translated': 1, 'transmitter': 0, 'transparency': 0, 'travel': 0, 'traveled': 0, 'traveling': 0, 'treated': 0, 'tree': 0, 'trend': 0, 'trending': 0, 'tribe': 0, 'trip': 0, 'trisolaran': 1, 'troop': 0, 'trouble': 0, 'true': 0, 'truly': 0, 'trump': 0, 'trust': 0, 'trusting': 0, 'truth': 0, 'try': 0, 'trying': 0, 'tune': 0, 'turn': 0, 'turned': 0, 'tv': 0, 'two': 0, 'typically': 0, 'ubiquitous': 0, 'uk': 0, 'ultimate': 0, 'umbrella': 0, 'unavoidably': 0, 'uncharted': 0, 'uncle': 0, 'under': 0, 'underlined': 0, 'understand': 1, 'underwater': 0, 'unemployment': 0, 'unfolded': 0, 'unique': 0, 'uniquely': 0, 'united': 0, 'unity': 0, 'universal': 0, 'universe': 2, 'unknown': 0, 'unlike': 0, 'unsolvable': 1, 'unveiled': 1, 'up': 1, 'upbeat': 0, 'upon': 0, 'us': 0, 'use': 0, 'used': 0, 'useful': 0, 'user': 0, 'usher': 0, 'using': 0, 'usual': 0, 'usually': 0, 'utterly': 0, 'vacuum': 0, 'vague': 0, 'value': 0, 'vanished': 0, 'variety': 0, 'various': 0, 'vary': 0, 'vastly': 0, 'vcs': 0, 've': 2, 'very': 0, 'viewed': 0, 'vigilant': 0, 'vindicate': 0, 'virtuous': 0, 'virus': 0, 'vision': 0, 'visionary': 0, 'visualization': 0, 'vivid': 0, 'vote': 0, 'vr': 0, 'wa': 7, 'waiting': 0, 'walk': 0, 'want': 0, 'wanted': 0, 'war': 0, 'warfare': 0, 'warning': 0, 'was': 0, 'wasteland': 0, 'watch': 0, 'water': 0, 'watney': 0, 'wave': 0, 'way': 2, 'we': 2, 'weak': 0, 'weakness': 0, 'wealth': 0, 'wealthier': 0, 'wealthy': 0, 'weapon': 0, 'weave': 0, 'weigh': 0, 'weir': 0, 'welfare': 0, 'well': 0, 'went': 0, 'were': 0, 'werner': 0, 'western': 0, 'what': 3, 'whatever': 0, 'when': 1, 'whenever': 0, 'where': 2, 'whereas': 0, 'whether': 0, 'which': 1, 'while': 0, 'whiny': 0, 'whip': 0, 'white': 0, 'who': 2, 'whole': 0, 'why': 0, 'widely': 0, 'widespread': 0, 'wife': 0, 'will': 1, 'willful': 0, 'wilt': 0, 'wind': 0, 'winner': 1, 'winning': 0, 'wipe': 0, 'wired': 0, 'with': 1, 'within': 0, 'without': 0, 'wizard': 0, 'wo': 0, 'woman': 0, 'won': 0, 'wonder': 0, 'wool': 0, 'word': 0, 'work': 0, 'worker': 0, 'working': 0, 'world': 0, 'worrying': 0, 'worse': 0, 'worshiped': 0, 'worst': 0, 'worth': 0, 'worthwhile': 0, 'would': 4, 'wove': 0, 'wow': 0, 'write': 0, 'writing': 0, 'written': 0, 'wrong': 0, 'wrote': 0, 'ww1': 0, 'wwi': 0, 'wwii': 0, 'www': 0, 'year': 0, 'yes': 0, 'yet': 0, 'you': 0, 'young': 0, 'your': 1, 'yourself': 0, 'zero': 0, 'zooming': 0}"
